{
  "$schema": "https://json-schema.org/draft/2020-12/schema",
  "$id": "https://amise-medflow.local/clinical-content/visit-continuity.schema.json",
  "title": "Visit continuity word rules",
  "description": "clinical-content/rules/visit-continuity.json: the words that decide whether today's complaint is the same problem as the last visit (stop words, body-region map, suffix trimming, minimum word length). A shared clinical rule file read by the web (lib/triage-engine/src/visit-continuity.ts) and iOS (VisitContinuity.swift through SharedClinicalContent); the matching logic stays twinned. Registered as visit-continuity.",
  "type": "object",
  "additionalProperties": false,
  "required": ["id", "version", "minWordLength", "stopWords", "regions", "suffixRules"],
  "properties": {
    "$schema": { "type": "string" },
    "$comment": { "type": "string" },
    "id": { "const": "visit-continuity" },
    "version": { "type": "string", "pattern": "^\\d+\\.\\d+\\.\\d+$" },
    "minWordLength": { "description": "A word shorter than this (in letters) is not a content word, unless it is a region word.", "type": "integer", "minimum": 1 },
    "stopWords": {
      "description": "Lower-case words that say nothing about which problem it is.",
      "type": "array",
      "uniqueItems": true,
      "items": { "type": "string", "pattern": "^[a-z]+$" }
    },
    "regions": {
      "description": "Region token (\"region-abdomen\") -> the lower-case words for that body region, so a reworded complaint about the same area is not a new problem. A word belongs to one region only.",
      "type": "object",
      "propertyNames": { "pattern": "^region-[a-z]+$" },
      "additionalProperties": {
        "type": "array",
        "minItems": 1,
        "uniqueItems": true,
        "items": { "type": "string", "pattern": "^[a-z]+$" }
      }
    },
    "suffixRules": {
      "description": "Trim the first suffix (in this order) a word ends with, unless it ends with keepEnding, when at least minStemLength letters remain.",
      "type": "object",
      "additionalProperties": false,
      "required": ["suffixes", "keepEnding", "minStemLength"],
      "properties": {
        "suffixes": { "type": "array", "minItems": 1, "items": { "type": "string", "pattern": "^[a-z]+$" } },
        "keepEnding": { "type": "string", "pattern": "^[a-z]+$" },
        "minStemLength": { "type": "integer", "minimum": 1 }
      }
    }
  }
}
